{
  "schema_id": "asset-mania/engine-clearance",
  "schema_version": "1.0",
  "engine": "triposr-local",
  "components": [
    {
      "role": "engine_code",
      "name": "engine-code",
      "revision": "rev-a1b2c3d4",
      "content_sha256": "a1a1a1a1a1a1a1a1a1a1a1a1a1a1a1a1a1a1a1a1a1a1a1a1a1a1a1a1a1a1a1a1",
      "license_spdx": "PLACEHOLDER-SPDX",
      "license_url": "https://example.invalid/licenses/engine-code",
      "commercial_use": "cleared",
      "download_receipt_sha256": "d1d1d1d1d1d1d1d1d1d1d1d1d1d1d1d1d1d1d1d1d1d1d1d1d1d1d1d1d1d1d1d1"
    },
    {
      "role": "model_weights",
      "name": "model-weights",
      "revision": "rev-e5f6a7b8",
      "content_sha256": "a2a2a2a2a2a2a2a2a2a2a2a2a2a2a2a2a2a2a2a2a2a2a2a2a2a2a2a2a2a2a2a2",
      "license_spdx": "PLACEHOLDER-SPDX",
      "license_url": "https://example.invalid/licenses/model-weights",
      "commercial_use": "unknown",
      "download_receipt_sha256": "d2d2d2d2d2d2d2d2d2d2d2d2d2d2d2d2d2d2d2d2d2d2d2d2d2d2d2d2d2d2d2d2"
    },
    {
      "role": "preprocessing_model",
      "name": "background-remover",
      "revision": "rev-c9d0e1f2",
      "content_sha256": "a3a3a3a3a3a3a3a3a3a3a3a3a3a3a3a3a3a3a3a3a3a3a3a3a3a3a3a3a3a3a3a3",
      "license_spdx": "PLACEHOLDER-SPDX",
      "license_url": "https://example.invalid/licenses/background-remover",
      "commercial_use": "cleared",
      "download_receipt_sha256": "d3d3d3d3d3d3d3d3d3d3d3d3d3d3d3d3d3d3d3d3d3d3d3d3d3d3d3d3d3d3d3d3"
    }
  ],
  "runtime_dependencies": [
    {
      "name": "dependency-alpha",
      "revision": "1.2.3",
      "content_sha256": "b1b1b1b1b1b1b1b1b1b1b1b1b1b1b1b1b1b1b1b1b1b1b1b1b1b1b1b1b1b1b1b1",
      "license_spdx": "PLACEHOLDER-SPDX",
      "license_url": "https://example.invalid/licenses/dependency-alpha",
      "commercial_use": "cleared",
      "download_receipt_sha256": "e1e1e1e1e1e1e1e1e1e1e1e1e1e1e1e1e1e1e1e1e1e1e1e1e1e1e1e1e1e1e1e1"
    },
    {
      "name": "dependency-beta",
      "revision": "4.5.6",
      "content_sha256": "b2b2b2b2b2b2b2b2b2b2b2b2b2b2b2b2b2b2b2b2b2b2b2b2b2b2b2b2b2b2b2b2",
      "license_spdx": "PLACEHOLDER-SPDX",
      "license_url": "https://example.invalid/licenses/dependency-beta",
      "commercial_use": "prohibited",
      "download_receipt_sha256": "e2e2e2e2e2e2e2e2e2e2e2e2e2e2e2e2e2e2e2e2e2e2e2e2e2e2e2e2e2e2e2e2"
    },
    {
      "name": "dependency-gamma",
      "revision": "7.8.9",
      "content_sha256": "b3b3b3b3b3b3b3b3b3b3b3b3b3b3b3b3b3b3b3b3b3b3b3b3b3b3b3b3b3b3b3b3",
      "license_spdx": "PLACEHOLDER-SPDX",
      "license_url": "https://example.invalid/licenses/dependency-gamma",
      "commercial_use": "cleared",
      "download_receipt_sha256": "e3e3e3e3e3e3e3e3e3e3e3e3e3e3e3e3e3e3e3e3e3e3e3e3e3e3e3e3e3e3e3e3"
    }
  ],
  "cleared_by": "user",
  "cleared_at": "2026-08-21T09:00:00Z",
  "expires_at": "2026-09-20T09:00:00Z",
  "clearance_sha256": "8c8e724cec12fbd347d41b884f243510204715ead9d137d6b1072aca0ba0fccb"
}
